{
  "authoritative": false,
  "authority": "educational-model",
  "blind_comparison": {
    "candidate_ids": [
      "morph",
      "articulation"
    ],
    "prompt": "Welche Modellvariante wirkt im Vergleich zur Referenz weniger instrumentenartig?",
    "reference_id": "reference",
    "stores_results": false
  },
  "does_not_establish": [
    "biological equivalence",
    "species identity",
    "semantic meaning of calls",
    "perceptual superiority without blinded participants",
    "natural realism across all 88 piano keys"
  ],
  "kind": "buckelwal_learning_lesson",
  "lesson_id": "from-tone-to-whale-unit-v1",
  "model_sources": {
    "morph_manifest": {
      "anchor_count": 7,
      "file": "assets/whale-sources/morph/manifest.json",
      "sha256": "70fb0f19dddf812ac9a83160cd55c751340c18b7522101b6f42110c594717600"
    },
    "source_manifest": {
      "file": "assets/whale-sources/processed/manifest.json",
      "sha256": "cdea5da13edf435a631043459eef2687cc973386dd28c287c33efbf13dc6fd67"
    },
    "sources": [
      {
        "attribution": "U.S. National Park Service \u2014 Humpback whale moo, Glacier Bay hydrophone recording, September 2001",
        "id": "humpback-moo-nps",
        "license": "Public-Domain-US-NPS",
        "license_url": "https://www.nps.gov/aboutus/disclaimer.htm",
        "source_page": "https://commons.wikimedia.org/wiki/File:Humpback_whale_moo.ogg",
        "title": "Humpback whale moo"
      },
      {
        "attribution": "Spyrogumas \u2014 Song of Humpback Whales",
        "id": "humpback-song-cc0",
        "license": "CC0-1.0",
        "license_url": "https://creativecommons.org/publicdomain/zero/1.0/",
        "source_page": "https://commons.wikimedia.org/wiki/File:Humpbackwhale2.ogg",
        "title": "Song of Humpback Whales"
      },
      {
        "attribution": "Ellen C. Garland, Jason Gedamke, Melinda L. Rekdahl, Michael J. Noad, Claire Garrigue, Nick Gales \u2014 New Caledonia 2010 song, Acoustic File S3; supporting audio for Humpback Whale Song on the Southern Ocean Feeding Grounds: Implications for Cultural Transmission (2013), PLOS ONE",
        "id": "song-new-caledonia-2010",
        "license": "CC-BY-2.5",
        "license_url": "https://creativecommons.org/licenses/by/2.5/",
        "source_page": "https://commons.wikimedia.org/wiki/File:Humpback-Whale-Song-on-the-Southern-Ocean-Feeding-Grounds-Implications-for-Cultural-Transmission-pone.0079422.s003.oga",
        "title": "New Caledonia 2010 song, Acoustic File S3"
      },
      {
        "attribution": "Alison K. Stimpert, Lindsey E. Peavey, Ari S. Friedlaender, Douglas P. Nowacek \u2014 Representative song phrases from record mn133a, Acoustic File S2; supporting audio for Humpback Whale Song and Foraging Behavior on an Antarctic Feeding Ground (2012), PLOS ONE",
        "id": "song-foraging-mn133a",
        "license": "CC-BY-2.5",
        "license_url": "https://creativecommons.org/licenses/by/2.5/",
        "source_page": "https://commons.wikimedia.org/wiki/File:Humpback-Whale-Song-and-Foraging-Behavior-on-an-Antarctic-Feeding-Ground-pone.0051214.s002.oga",
        "title": "Representative song phrases from record mn133a, Acoustic File S2"
      }
    ]
  },
  "question": "Welche zeitlichen Merkmale machen aus einem Ton einen wal\u00e4hnlichen Ruf?",
  "read_only": true,
  "reference_source": {
    "attribution": "Spyrogumas \u2014 Song of Humpback Whales",
    "clip_id": "humpback-song-cc0-01",
    "file": "assets/whale-sources/processed/humpback-song-cc0-01.wav",
    "license": "CC0-1.0",
    "sha256": "407b28ce102e53d30114fc9fb40e54bf4037357efcf50ab54df34a3d318df09c",
    "source_id": "humpback-song-cc0"
  },
  "schema_version": 1,
  "source_revision_contract": "generated-from-current-bound-repository-assets",
  "steps": [
    {
      "id": "hear",
      "instruction": "H\u00f6re zuerst Referenz und Morph, ohne die Kurven zu betrachten.",
      "title": "1 \u00b7 H\u00f6ren"
    },
    {
      "id": "separate",
      "instruction": "Schalte die Modellstufen nacheinander frei und achte jeweils nur auf den benannten Unterschied.",
      "title": "2 \u00b7 Zerlegen"
    },
    {
      "id": "inspect",
      "instruction": "Vergleiche H\u00fcllkurve, Periodizit\u00e4t und Rauigkeit. Die Kurven sind Messungen, keine Bedeutungs\u00fcbersetzung.",
      "title": "3 \u00b7 Sehen"
    },
    {
      "id": "judge",
      "instruction": "Vergleiche A und B gegen die Referenz. Das lokale Urteil wird nicht gespeichert und ist kein wissenschaftlicher Test.",
      "title": "4 \u00b7 Blind vergleichen"
    }
  ],
  "title": "Vom reinen Ton zur Buckelwaleinheit",
  "truth_layers": {
    "extrapolation": "Die chromatische 88-Tasten-Spielbarkeit ist musikalisch und nicht biologisch.",
    "model": "Reproduzierbare technische Ann\u00e4herung mit einzeln benannten Komponenten.",
    "observation": "Echte, lizenzierte Aufnahme mit Aufnahmebedingungen."
  },
  "variants": [
    {
      "audio_bytes": 307244,
      "audio_file": "whale-learning-reference.wav",
      "audio_sha256": "ed2b28b8c95b889daad31d9d92922f8ac95afc5b62bfa72b14178b0b9d6e13be",
      "channels": 1,
      "description": "Echter lizenzierter Buckelwal-Ausschnitt: auf die ersten 3,2 Sekunden gek\u00fcrzt, an den R\u00e4ndern weich ausgeblendet und f\u00fcr den H\u00f6rvergleich pegelnormalisiert. Aufnahmebedingungen und Hintergrund bleiben Teil der Beobachtung.",
      "duration_seconds": 3.2,
      "enabled_components": [],
      "features": {
        "envelope": [
          0.5353682,
          0.54960269,
          0.59012648,
          0.57649245,
          0.66267983,
          0.8775753,
          0.98419342,
          1.0,
          0.960921,
          0.96390347,
          0.97621779,
          0.94781723,
          0.89260013,
          0.88556664,
          0.79007962,
          0.66652998,
          0.55748221,
          0.65448682,
          0.68976406,
          0.68282447,
          0.63222359,
          0.71241817,
          0.80087378,
          0.86768949,
          0.94930524,
          0.94590649,
          0.87537631,
          0.77493889,
          0.67337467,
          0.55391645,
          0.47873012,
          0.49671172,
          0.51200927,
          0.49637271,
          0.48065943,
          0.46142282,
          0.46190254,
          0.50551777,
          0.48163116,
          0.50864067,
          0.48266389,
          0.49168218,
          0.43726089,
          0.43106073,
          0.43499262,
          0.48132517,
          0.46011233,
          0.47351173
        ],
        "periodicity": [
          0.4843822,
          0.4843822,
          0.3996667,
          0.45064018,
          0.63225758,
          0.81265683,
          0.89106255,
          0.86961706,
          0.83733161,
          0.90159592,
          0.8819849,
          0.84689834,
          0.86796454,
          0.82993545,
          0.86201661,
          0.5869321,
          0.48119544,
          0.64135105,
          0.71434825,
          0.5250263,
          0.51448646,
          0.42266692,
          0.5889122,
          0.63999477,
          0.56040173,
          0.6318208,
          0.63319212,
          0.55954814,
          0.65457149,
          0.36359392,
          0.3405637,
          0.3590411,
          0.27113385,
          0.26753145,
          0.35034637,
          0.26104779,
          0.36978598,
          0.39907177,
          0.34340359,
          0.38867887,
          0.29556611,
          0.30405117,
          0.51517165,
          0.39666398,
          0.27376845,
          0.34792034,
          0.48763637,
          0.48763637
        ],
        "roughness": [
          0.5156178,
          0.5156178,
          0.6003333,
          0.54935982,
          0.36774242,
          0.18734317,
          0.10893745,
          0.13038294,
          0.16266839,
          0.09840408,
          0.1180151,
          0.15310166,
          0.13203546,
          0.17006455,
          0.13798339,
          0.4130679,
          0.51880456,
          0.35864895,
          0.28565175,
          0.4749737,
          0.48551354,
          0.57733308,
          0.4110878,
          0.36000523,
          0.43959827,
          0.3681792,
          0.36680788,
          0.44045186,
          0.34542851,
          0.63640608,
          0.6594363,
          0.6409589,
          0.72886615,
          0.73246855,
          0.64965363,
          0.73895221,
          0.63021402,
          0.60092823,
          0.65659641,
          0.61132113,
          0.70443389,
          0.69594883,
          0.48482835,
          0.60333602,
          0.72623155,
          0.65207966,
          0.51236363,
          0.51236363
        ]
      },
      "id": "reference",
      "listen_for": "Achte auf wechselnde Ordnung, Kanten und einen nicht symmetrischen Verlauf.",
      "normalization": "active-rms-target-0.055-peak-limit-0.30",
      "sample_rate_hz": 48000,
      "summary": {
        "boundary_hits": 1,
        "median_periodicity": 0.5889122,
        "reason_counts": {
          "low-periodicity": 12,
          "search-boundary-high": 1,
          "voiced": 35
        },
        "voiced_fraction": 0.72916667
      },
      "title": "Echte Referenz",
      "truth_layer": "observation"
    },
    {
      "audio_bytes": 307244,
      "audio_file": "whale-learning-morph.wav",
      "audio_sha256": "37b6c95269f02c27c89cd033026b1d275f7ee6cc51e11b6dc4ec7cd38ae48418",
      "channels": 1,
      "description": "Die aktuelle sichere Grundengine: ein tastengebundener, quellengest\u00fctzter Zyklus ohne zus\u00e4tzliche Organic-Schichten.",
      "duration_seconds": 3.2,
      "enabled_components": [],
      "features": {
        "envelope": [
          0.53407046,
          0.69146084,
          0.84282684,
          0.91209805,
          0.93260795,
          0.93812406,
          0.94080559,
          0.94344593,
          0.94649187,
          0.9500265,